{
  "$id": "urn:wr:nextflow-conformance:schema:1:target.json",
  "$schema": "https://json-schema.org/draft/2020-12/schema",
  "additionalProperties": false,
  "properties": {
    "commit": {
      "pattern": "^[a-f0-9]{40}(?![\\s\\S])",
      "type": "string",
      "x-wr-field-rules": [
        "git"
      ]
    },
    "decisions": {
      "items": {
        "pattern": "^[A-Z][A-Z0-9_]*(?![\\s\\S])",
        "type": "string"
      },
      "type": "array",
      "uniqueItems": true,
      "x-wr-field-rules": [
        "ids"
      ],
      "x-wr-reference": "decisions"
    },
    "id": {
      "pattern": "^[A-Z][A-Z0-9_]*(?![\\s\\S])",
      "type": "string",
      "x-wr-field-rules": [
        "id"
      ]
    },
    "parser": {
      "enum": [
        "v2"
      ],
      "type": "string",
      "x-wr-field-rules": [
        "enum:v2"
      ]
    },
    "profiles": {
      "additionalProperties": false,
      "properties": {
        "foundation-bootstrap": {
          "additionalProperties": false,
          "properties": {
            "required_cases": {
              "items": {
                "pattern": "^[A-Z][A-Z0-9_]*(?![\\s\\S])",
                "type": "string"
              },
              "minItems": 1,
              "type": "array",
              "uniqueItems": true,
              "x-wr-field-rules": [
                "ids",
                "nonempty"
              ],
              "x-wr-reference": "case"
            },
            "required_gates": {
              "items": {
                "minLength": 1,
                "not": {
                  "anyOf": [
                    {
                      "pattern": "^[\t-\r    - \u2028\u2029  　]*(?:[Tt][Oo][Dd][Oo]|[Tt][Bb][Dd]|[Pp][Ll][Aa][Cc][Ee][Hh][Oo][Ll][Dd][Ee][Rr])[\t-\r    - \u2028\u2029  　]*$"
                    },
                    {
                      "pattern": "^(?:[\t-\r    - \u2028\u2029  　]*|(?:(?:\\\\[\\s\\S]|\"(?:[^\"\\\\]|\\\\[\\s\\S])*\"|`(?:[^`\\\\]|\\\\[\\s\\S])*`|(^|[\t-\r    - \u2028\u2029  　!#$%\u0026()*+,\\-./:;\u003c=\u003e?@\\[\\]^_{|}~])'(?:[^'\\\\]|\\\\[\\s\\S])*')|(?!(?:\\\\[\\s\\S]|\"(?:[^\"\\\\]|\\\\[\\s\\S])*\"|`(?:[^`\\\\]|\\\\[\\s\\S])*`|(^|[\t-\r    - \u2028\u2029  　!#$%\u0026()*+,\\-./:;\u003c=\u003e?@\\[\\]^_{|}~])'(?:[^'\\\\]|\\\\[\\s\\S])*'))[\\s\\S])*(?:[.!?:][\t-\r    - \u2028\u2029  　]+|`(?:[^`\\\\]|\\\\[\\s\\S])*`[.!?:]?[\t-\r    - \u2028\u2029  　]*|(?!(?:\\\\[\\s\\S]|\"(?:[^\"\\\\]|\\\\[\\s\\S])*\"|`(?:[^`\\\\]|\\\\[\\s\\S])*`|(^|[\t-\r    - \u2028\u2029  　!#$%\u0026()*+,\\-./:;\u003c=\u003e?@\\[\\]^_{|}~])'(?:[^'\\\\]|\\\\[\\s\\S])*'))`[.!?:]?[\t-\r    - \u2028\u2029  　]*))[Tt][Oo][Dd][Oo]: [Dd][Ee][Ssſ][Cc][Rr][Ii][Bb][Ee] [Ee][Xx][Pp][Ee][Cc][Tt][Ee][Dd] [Bb][Ee][Hh][Aa][Vv][Ii][Oo][Uu][Rr]\\.([\t-\r    - \u2028\u2029  　]|$)"
                    }
                  ]
                },
                "pattern": "[^\t-\r    - \u2028\u2029  　]"
              },
              "minItems": 1,
              "type": "array",
              "uniqueItems": true,
              "x-wr-field-rules": [
                "texts",
                "nonempty"
              ]
            },
            "required_ids": {
              "items": {
                "pattern": "^[A-Z][A-Z0-9_]*(?![\\s\\S])",
                "type": "string"
              },
              "minItems": 1,
              "type": "array",
              "uniqueItems": true,
              "x-wr-field-rules": [
                "ids",
                "nonempty"
              ],
              "x-wr-reference": "record"
            },
            "required_reviews": {
              "items": {
                "pattern": "^[A-Z][A-Z0-9_]*(?![\\s\\S])",
                "type": "string"
              },
              "minItems": 1,
              "type": "array",
              "uniqueItems": true,
              "x-wr-field-rules": [
                "ids",
                "nonempty"
              ],
              "x-wr-reference": "reviews"
            }
          },
          "required": [
            "required_ids",
            "required_cases",
            "required_reviews",
            "required_gates"
          ],
          "type": "object"
        },
        "target-inventory": {
          "additionalProperties": false,
          "properties": {
            "required_cases": {
              "items": {
                "pattern": "^[A-Z][A-Z0-9_]*(?![\\s\\S])",
                "type": "string"
              },
              "minItems": 1,
              "type": "array",
              "uniqueItems": true,
              "x-wr-field-rules": [
                "ids",
                "nonempty"
              ],
              "x-wr-reference": "case"
            },
            "required_gates": {
              "items": {
                "minLength": 1,
                "not": {
                  "anyOf": [
                    {
                      "pattern": "^[\t-\r    - \u2028\u2029  　]*(?:[Tt][Oo][Dd][Oo]|[Tt][Bb][Dd]|[Pp][Ll][Aa][Cc][Ee][Hh][Oo][Ll][Dd][Ee][Rr])[\t-\r    - \u2028\u2029  　]*$"
                    },
                    {
                      "pattern": "^(?:[\t-\r    - \u2028\u2029  　]*|(?:(?:\\\\[\\s\\S]|\"(?:[^\"\\\\]|\\\\[\\s\\S])*\"|`(?:[^`\\\\]|\\\\[\\s\\S])*`|(^|[\t-\r    - \u2028\u2029  　!#$%\u0026()*+,\\-./:;\u003c=\u003e?@\\[\\]^_{|}~])'(?:[^'\\\\]|\\\\[\\s\\S])*')|(?!(?:\\\\[\\s\\S]|\"(?:[^\"\\\\]|\\\\[\\s\\S])*\"|`(?:[^`\\\\]|\\\\[\\s\\S])*`|(^|[\t-\r    - \u2028\u2029  　!#$%\u0026()*+,\\-./:;\u003c=\u003e?@\\[\\]^_{|}~])'(?:[^'\\\\]|\\\\[\\s\\S])*'))[\\s\\S])*(?:[.!?:][\t-\r    - \u2028\u2029  　]+|`(?:[^`\\\\]|\\\\[\\s\\S])*`[.!?:]?[\t-\r    - \u2028\u2029  　]*|(?!(?:\\\\[\\s\\S]|\"(?:[^\"\\\\]|\\\\[\\s\\S])*\"|`(?:[^`\\\\]|\\\\[\\s\\S])*`|(^|[\t-\r    - \u2028\u2029  　!#$%\u0026()*+,\\-./:;\u003c=\u003e?@\\[\\]^_{|}~])'(?:[^'\\\\]|\\\\[\\s\\S])*'))`[.!?:]?[\t-\r    - \u2028\u2029  　]*))[Tt][Oo][Dd][Oo]: [Dd][Ee][Ssſ][Cc][Rr][Ii][Bb][Ee] [Ee][Xx][Pp][Ee][Cc][Tt][Ee][Dd] [Bb][Ee][Hh][Aa][Vv][Ii][Oo][Uu][Rr]\\.([\t-\r    - \u2028\u2029  　]|$)"
                    }
                  ]
                },
                "pattern": "[^\t-\r    - \u2028\u2029  　]"
              },
              "minItems": 1,
              "type": "array",
              "uniqueItems": true,
              "x-wr-field-rules": [
                "texts",
                "nonempty"
              ]
            },
            "required_ids": {
              "items": {
                "pattern": "^[A-Z][A-Z0-9_]*(?![\\s\\S])",
                "type": "string"
              },
              "minItems": 1,
              "type": "array",
              "uniqueItems": true,
              "x-wr-field-rules": [
                "ids",
                "nonempty"
              ],
              "x-wr-reference": "record"
            },
            "required_reviews": {
              "items": {
                "pattern": "^[A-Z][A-Z0-9_]*(?![\\s\\S])",
                "type": "string"
              },
              "minItems": 1,
              "type": "array",
              "uniqueItems": true,
              "x-wr-field-rules": [
                "ids",
                "nonempty"
              ],
              "x-wr-reference": "reviews"
            }
          },
          "required": [
            "required_ids",
            "required_cases",
            "required_reviews",
            "required_gates"
          ],
          "type": "object"
        },
        "wr-runtime": {
          "additionalProperties": false,
          "properties": {
            "required_cases": {
              "items": {
                "pattern": "^[A-Z][A-Z0-9_]*(?![\\s\\S])",
                "type": "string"
              },
              "minItems": 1,
              "type": "array",
              "uniqueItems": true,
              "x-wr-field-rules": [
                "ids",
                "nonempty"
              ],
              "x-wr-reference": "case"
            },
            "required_gates": {
              "items": {
                "minLength": 1,
                "not": {
                  "anyOf": [
                    {
                      "pattern": "^[\t-\r    - \u2028\u2029  　]*(?:[Tt][Oo][Dd][Oo]|[Tt][Bb][Dd]|[Pp][Ll][Aa][Cc][Ee][Hh][Oo][Ll][Dd][Ee][Rr])[\t-\r    - \u2028\u2029  　]*$"
                    },
                    {
                      "pattern": "^(?:[\t-\r    - \u2028\u2029  　]*|(?:(?:\\\\[\\s\\S]|\"(?:[^\"\\\\]|\\\\[\\s\\S])*\"|`(?:[^`\\\\]|\\\\[\\s\\S])*`|(^|[\t-\r    - \u2028\u2029  　!#$%\u0026()*+,\\-./:;\u003c=\u003e?@\\[\\]^_{|}~])'(?:[^'\\\\]|\\\\[\\s\\S])*')|(?!(?:\\\\[\\s\\S]|\"(?:[^\"\\\\]|\\\\[\\s\\S])*\"|`(?:[^`\\\\]|\\\\[\\s\\S])*`|(^|[\t-\r    - \u2028\u2029  　!#$%\u0026()*+,\\-./:;\u003c=\u003e?@\\[\\]^_{|}~])'(?:[^'\\\\]|\\\\[\\s\\S])*'))[\\s\\S])*(?:[.!?:][\t-\r    - \u2028\u2029  　]+|`(?:[^`\\\\]|\\\\[\\s\\S])*`[.!?:]?[\t-\r    - \u2028\u2029  　]*|(?!(?:\\\\[\\s\\S]|\"(?:[^\"\\\\]|\\\\[\\s\\S])*\"|`(?:[^`\\\\]|\\\\[\\s\\S])*`|(^|[\t-\r    - \u2028\u2029  　!#$%\u0026()*+,\\-./:;\u003c=\u003e?@\\[\\]^_{|}~])'(?:[^'\\\\]|\\\\[\\s\\S])*'))`[.!?:]?[\t-\r    - \u2028\u2029  　]*))[Tt][Oo][Dd][Oo]: [Dd][Ee][Ssſ][Cc][Rr][Ii][Bb][Ee] [Ee][Xx][Pp][Ee][Cc][Tt][Ee][Dd] [Bb][Ee][Hh][Aa][Vv][Ii][Oo][Uu][Rr]\\.([\t-\r    - \u2028\u2029  　]|$)"
                    }
                  ]
                },
                "pattern": "[^\t-\r    - \u2028\u2029  　]"
              },
              "minItems": 1,
              "type": "array",
              "uniqueItems": true,
              "x-wr-field-rules": [
                "texts",
                "nonempty"
              ]
            },
            "required_ids": {
              "items": {
                "pattern": "^[A-Z][A-Z0-9_]*(?![\\s\\S])",
                "type": "string"
              },
              "minItems": 1,
              "type": "array",
              "uniqueItems": true,
              "x-wr-field-rules": [
                "ids",
                "nonempty"
              ],
              "x-wr-reference": "record"
            },
            "required_reviews": {
              "items": {
                "pattern": "^[A-Z][A-Z0-9_]*(?![\\s\\S])",
                "type": "string"
              },
              "minItems": 1,
              "type": "array",
              "uniqueItems": true,
              "x-wr-field-rules": [
                "ids",
                "nonempty"
              ],
              "x-wr-reference": "reviews"
            }
          },
          "required": [
            "required_ids",
            "required_cases",
            "required_reviews",
            "required_gates"
          ],
          "type": "object"
        }
      },
      "required": [
        "foundation-bootstrap",
        "target-inventory",
        "wr-runtime"
      ],
      "type": "object"
    },
    "schema": {
      "const": 1,
      "maximum": 9223372036854775807,
      "minimum": -9223372036854775808,
      "type": "integer",
      "x-wr-field-rules": [
        "one"
      ]
    },
    "source_tree": {
      "pattern": "^[a-f0-9]{40}(?![\\s\\S])",
      "type": "string",
      "x-wr-field-rules": [
        "git"
      ]
    },
    "tag": {
      "pattern": "^[a-f0-9]{40}(?![\\s\\S])",
      "type": "string",
      "x-wr-field-rules": [
        "git"
      ]
    },
    "version": {
      "minLength": 1,
      "not": {
        "anyOf": [
          {
            "pattern": "^[\t-\r    - \u2028\u2029  　]*(?:[Tt][Oo][Dd][Oo]|[Tt][Bb][Dd]|[Pp][Ll][Aa][Cc][Ee][Hh][Oo][Ll][Dd][Ee][Rr])[\t-\r    - \u2028\u2029  　]*$"
          },
          {
            "pattern": "^(?:[\t-\r    - \u2028\u2029  　]*|(?:(?:\\\\[\\s\\S]|\"(?:[^\"\\\\]|\\\\[\\s\\S])*\"|`(?:[^`\\\\]|\\\\[\\s\\S])*`|(^|[\t-\r    - \u2028\u2029  　!#$%\u0026()*+,\\-./:;\u003c=\u003e?@\\[\\]^_{|}~])'(?:[^'\\\\]|\\\\[\\s\\S])*')|(?!(?:\\\\[\\s\\S]|\"(?:[^\"\\\\]|\\\\[\\s\\S])*\"|`(?:[^`\\\\]|\\\\[\\s\\S])*`|(^|[\t-\r    - \u2028\u2029  　!#$%\u0026()*+,\\-./:;\u003c=\u003e?@\\[\\]^_{|}~])'(?:[^'\\\\]|\\\\[\\s\\S])*'))[\\s\\S])*(?:[.!?:][\t-\r    - \u2028\u2029  　]+|`(?:[^`\\\\]|\\\\[\\s\\S])*`[.!?:]?[\t-\r    - \u2028\u2029  　]*|(?!(?:\\\\[\\s\\S]|\"(?:[^\"\\\\]|\\\\[\\s\\S])*\"|`(?:[^`\\\\]|\\\\[\\s\\S])*`|(^|[\t-\r    - \u2028\u2029  　!#$%\u0026()*+,\\-./:;\u003c=\u003e?@\\[\\]^_{|}~])'(?:[^'\\\\]|\\\\[\\s\\S])*'))`[.!?:]?[\t-\r    - \u2028\u2029  　]*))[Tt][Oo][Dd][Oo]: [Dd][Ee][Ssſ][Cc][Rr][Ii][Bb][Ee] [Ee][Xx][Pp][Ee][Cc][Tt][Ee][Dd] [Bb][Ee][Hh][Aa][Vv][Ii][Oo][Uu][Rr]\\.([\t-\r    - \u2028\u2029  　]|$)"
          }
        ]
      },
      "pattern": "[^\t-\r    - \u2028\u2029  　]",
      "type": "string",
      "x-wr-field-rules": [
        "text"
      ]
    }
  },
  "required": [
    "schema",
    "id",
    "version",
    "parser",
    "tag",
    "commit",
    "source_tree",
    "profiles",
    "decisions"
  ],
  "title": "target version 1",
  "type": "object",
  "x-wr-record-rules": [
    "decodeRecord: UTF-8; final newline; no duplicate keys; no trailing value",
    "loadRecordFile/checkNested: sorted unique IDs and unique paths, environment keys and result UAT IDs",
    "checkRules: sorted unique identifier/text/index arrays; integer JSON lexical form",
    "checkReferences: typed references resolve within the same target revision",
    "checkSourceSpans: locked source file, matching hash, ordered span within byte bounds",
    "corpusIdentity: exactly one target and lock matching pinned version/tag/commit/tree"
  ]
}
